{
  "schema_version": 1,
  "host_id": "host-alpha",
  "run_id": "run-20260702-a",
  "vm_name": "webserver",
  "desired_version": 42,
  "observed_at_unix_ms": 1762041660000,
  "phase": "ready",
  "network": {
    "bridge_name": "intar-run-a",
    "guest_ip": "10.77.0.2",
    "guest_cidr": "10.77.0.2/28",
    "gateway": "10.77.0.1",
    "ssh_host_port": 22001
  },
  "ssh_host_keys_openssh": [
    "ssh-ed25519 AAAAC3NzaC1lZDI1NTE5AAAAIhostkey webserver"
  ],
  "probes": [
    {
      "id": "nginx-running",
      "phase": "scenario",
      "status": "fail",
      "checked_at_unix_ms": 1762041655000,
      "message": "nginx is stopped",
      "value": {
        "service": "nginx",
        "desired_state": "running",
        "actual_state": "inactive"
      }
    }
  ],
  "archive": {
    "phase": "none",
    "artifact_count": 0
  }
}
